[{"analyzer_config":{"dictionary":"ipadic","mode":"normal","name":"lindera_ipadic"},"language":"ja","query_id":"q_sepsis_bl","query_text":"敗血症 βラクタム 投与"},{"analyzer_config":{"dictionary":"ipadic","mode":"normal","name":"lindera_ipadic"},"language":"ja","query_id":"q_contra_allergy","query_text":"アナフィラキシー 禁忌"},{"analyzer_config":{"dictionary":"ipadic","mode":"normal","name":"lindera_ipadic"},"language":"ja","query_id":"q_allergy_history","query_text":"薬物アレルギー歴 確認 既往"},{"analyzer_config":{"dictionary":"ipadic","mode":"normal","name":"lindera_ipadic"},"language":"ja","query_id":"q_vitals_temp","query_text":"体温"},{"analyzer_config":{"dictionary":"ipadic","mode":"normal","name":"lindera_ipadic"},"language":"ja","query_id":"q_provenance","query_text":"ガイドライン 第5版 発行"},{"analyzer_config":{"dictionary":"ipadic","mode":"normal","name":"lindera_ipadic"},"language":"ja","query_id":"q_term_variants","query_text":"βラクタム ベータラクタム 化学構造"}]